{
  "format": "SWLS_LEARNING_RECORD",
  "version": "1.0-beta",
  "article_id": "A000001",
  "article_url": "https://example.com/article",
  "recorded_at": "2026-07-19",
  "batch_key": "BATCH-001",
  "diagnosis": [
    "POSITION_OPPORTUNITY"
  ],
  "decision": "PASS_WITH_WARNING",
  "confidence": "medium",
  "effect_confidence": "medium",
  "change_targets": [
    "seo_title",
    "introduction"
  ],
  "validation_rules": {
    "failed": [],
    "warnings": [
      "VAL-SAMPLE-001"
    ]
  },
  "uncertainties": [
    "効果測定前"
  ],
  "preserved_elements": [
    "実体験",
    "広告コード"
  ],
  "learning_candidates": [
    {
      "target": "RUNTIME",
      "proposal": "通常注意事項とValidation警告を区別する",
      "evidence": "warningsとvalidation.resultの不整合が再発",
      "confidence": "high"
    }
  ],
  "measurement_due_days": 30,
  "notes": []
}
